{
  "schema_version": "fusion_planner_artifact.v1",
  "arm_id": "codex",
  "case_id": "nema17_bracket",
  "planner": {
    "provider": "OpenAI",
    "model": "gpt-5.6-sol",
    "reasoning_profile": "ultra"
  },
  "intent": "Compile a connected parametric NEMA 17 bracket from a typed feature graph.",
  "assumptions": ["The independent oracle, not planner assertions, determines correctness."],
  "parameters": [{"name": "BaseWidth", "expression": "90 mm"}],
  "build_graph": [
    {
      "id": "base_plate",
      "operation": "extrude",
      "depends_on": [],
      "target_component": "root",
      "inputs": {"width": "BaseWidth", "operation": "new_body"}
    }
  ],
  "verification_assertions": [
    {"id": "single_body", "target": "summary.visible_body_count", "operator": "eq", "expected": 1}
  ],
  "script_sha256": "e8d7186d98a70c276160e378ccc633f43bde9772bb1cbb3884107d696e5ac944"
}
